{
  "$schema": "http://json-schema.org/draft-07/schema#",
  "description": "Official Replicate API schema for black-forest-labs/flux-2-dev",
  "properties": {
    "seed": {
      "type": "integer",
      "title": "Seed",
      "x-order": 6,
      "nullable": true,
      "description": "Random seed. Set for reproducible generation."
    },
    "width": {
      "type": "integer",
      "title": "Width",
      "maximum": 1440,
      "minimum": 256,
      "x-order": 4,
      "nullable": true,
      "description": "Width of the generated image in text-to-image mode. Only used when aspect_ratio=custom. Must be a multiple of 32 (if it's not, it will be rounded to nearest multiple of 32)."
    },
    "height": {
      "type": "integer",
      "title": "Height",
      "maximum": 1440,
      "minimum": 256,
      "x-order": 5,
      "nullable": true,
      "description": "Height of the generated image in text-to-image mode. Only used when aspect_ratio=custom. Must be a multiple of 32 (if it's not, it will be rounded to nearest multiple of 32)."
    },
    "prompt": {
      "type": "string",
      "title": "Prompt",
      "x-order": 0,
      "description": "Text description of the image to generate."
    },
    "go_fast": {
      "type": "boolean",
      "title": "Go Fast",
      "default": true,
      "x-order": 2,
      "description": "Run faster predictions with additional optimizations."
    },
    "aspect_ratio": {
      "allOf": [
        {
          "$ref": "#/components/schemas/aspect_ratio"
        }
      ],
      "default": "1:1",
      "x-order": 3,
      "description": "Aspect ratio for the generated image. Use 'match_input_image' to match the first input image's aspect ratio."
    },
    "input_images": {
      "type": "array",
      "items": {
        "type": "string",
        "format": "uri"
      },
      "title": "Input Images",
      "default": [],
      "x-order": 1,
      "description": "List of input images for image-to-image generation. Maximum 4 images. Must be jpeg, png, gif, or webp."
    },
    "output_format": {
      "allOf": [
        {
          "$ref": "#/components/schemas/output_format"
        }
      ],
      "default": "webp",
      "x-order": 7,
      "description": "Format of the output images."
    },
    "output_quality": {
      "type": "integer",
      "title": "Output Quality",
      "default": 80,
      "maximum": 100,
      "minimum": 0,
      "x-order": 8,
      "description": "Quality when saving the output images, from 0 to 100. 100 is best quality, 0 is lowest quality. Not relevant for .png outputs."
    },
    "disable_safety_checker": {
      "type": "boolean",
      "title": "Disable Safety Checker",
      "default": false,
      "x-order": 9,
      "description": "Disable safety checker for generated images."
    }
  },
  "required": ["prompt"],
  "title": "flux-2-dev Input Schema",
  "type": "object"
}
