{
  "aspect_ratio": "1:1",
  "disable_safety_checker": false,
  "go_fast": false,
  "input_images": ["asset_product_123", "asset_product_124"],
  "output_format": "jpg",
  "output_quality": 80,
  "prompt": "Create a launch image for the new bottle. Reusable bottle. sun-drenched ceramics studio. Centered product portrait. soft window light. Clean editorial product photography. Visible text: NEW. Keep the bottle label readable",
  "seed": 42
}
